UC1:
Create Database:
mysql> CREATE DATABASE payroll_service;

UC2:
Create Employee Payroll Table
mysql> CREATE TABLE employee_payroll(id int PRIMARY KEY AUTO_INCREMENT , Name varchar(20) , Salary int , Start_Date DATE);
Query OK, 0 rows affected (1.64 sec)

mysql> desc employee_payroll;
+------------+-------------+------+-----+---------+----------------+
| Field      | Type        | Null | Key | Default | Extra          |
+------------+-------------+------+-----+---------+----------------+
| id         | int         | NO   | PRI | NULL    | auto_increment |
| Name       | varchar(20) | YES  |     | NULL    |                |
| Salary     | int         | YES  |     | NULL    |                |
| Start_Date | date        | YES  |     | NULL    |                |
+------------+-------------+------+-----+---------+----------------+
4 rows in set (0.01 sec)

UC3:
Create employee payroll data
mysql> INSERT INTO employee_payroll VALUES(1,"Moinuddin Asraf", 1110000, '2022-3-01');
Query OK, 1 row affected (0.12 sec)

mysql> INSERT INTO employee_payroll VALUES(2,"Albert Murphy", 55000, '2022-2-01');
Query OK, 1 row affected (0.12 sec)

UC4:
Retreive employee payroll data
mysql> select * from employee_payroll;
+----+-----------------+---------+------------+
| id | Name            | Salary  | Start_Date |
+----+-----------------+---------+------------+
|  1 | Moinuddin Asraf | 1110000 | 2022-03-01 |
|  3 | Albert Murphy   |   55900 | 2021-09-10 |
+----+-----------------+---------+------------+
2 rows in set (0.00 sec)

UC5:
Retreive Salary by Name
mysql> SELECT Salary FROM employee_payroll WHERE name ="Moinuddin Asraf";
+---------+
| Salary  |
+---------+
| 1110000 |
+---------+
1 row in set (0.00 sec)

mysql> SELECT Name, Start_Date FROM employee_payroll WHERE Start_Date Between CAST('2022-01-01'AS DATE) AND DATE(NOW());
+-----------------+------------+
| Name            | Start_Date |
+-----------------+------------+
| Moinuddin Asraf | 2022-03-01 |
| Albert Murphy   | 2022-02-01 |
+-----------------+------------+
2 rows in set (0.00 sec)

UC6:
Add Gender Column and assign values to it:
mysql> ALTER TABLE employee_payroll ADD Gender varchar(6);
Query OK, 0 rows affected (0.04 sec)
Records: 0  Duplicates: 0  Warnings: 0

mysql> UPDATE employee_payroll SET Gender = "MALE" WHERE Name = "Moinuddin Asraf";
Query OK, 1 row affected (0.01 sec)
Rows matched: 1  Changed: 1  Warnings: 0

mysql> select * from employee_payroll;
+----+-----------------+---------+------------+--------+
| id | Name            | Salary  | Start_Date | Gender |
+----+-----------------+---------+------------+--------+
|  1 | Moinuddin Asraf | 1110000 | 2022-03-01 | MALE   |
|  2 | Albert Murphy   |   55000 | 2022-02-01 | NULL   |
+----+-----------------+---------+------------+--------+
2 rows in set (0.01 sec)

UC7:
Find Sum, Average, Min, max, and number of male and femal employee:
  SELECT SUM(salary) FROM employee_payroll WHERE Gender = "MALE" BY Gender;
	SELECT AVG(Salary) FROM employee_payroll GROUP BY Gender;
	SELECT MIN(Salary) FROM employee_payroll GROUP BY Gender;
	SELECT MAX(Salary) FROM employee_payroll GROUP BY Gender;
	SELECT Gender, COUNT(Gender) FROM employee_payroll GROUP BY Gender;
    
  UC8:
  Adding New Columns with Department as non null field and Default Address:
  mysql> ALTER TABLE employee_payroll ADD Phone int, ADD Address varchar(50) DEFAULT 'Delhi', ADD Department varchar(50) NOT NULL;
Query OK, 0 rows affected (0.04 sec)
Records: 0  Duplicates: 0  Warnings: 0

mysql> select * from employee_payroll;
+----+-----------------+---------+------------+--------+-------+---------+------------+
| id | Name            | Salary  | Start_Date | Gender | Phone | Address | Department |
+----+-----------------+---------+------------+--------+-------+---------+------------+
|  1 | Moinuddin Asraf | 1110000 | 2022-03-01 | MALE   |  NULL | Delhi   |            |
|  2 | Albert Murphy   |   55000 | 2022-02-01 | NULL   |  NULL | Delhi   |            |
+----+-----------------+---------+------------+--------+-------+---------+------------+
2 rows in set (0.01 sec)

UC9:
Adding new columns Basic_Salary, Deductions, Taxable_Pay, Income_Tax, Net_Pay:
mysql> ALTER TABLE employee_payroll ADD Basic_Pay int, ADD Deductions int, ADD Taxable_Pay int, ADD Income_Tax int, ADD Net_Pay int;
Query OK, 0 rows affected (0.12 sec)
Records: 0  Duplicates: 0  Warnings: 0

mysql> select * from employee_payroll;
+----+-----------------+---------+------------+--------+-------+---------+------------+-----------+------------+-------------+------------+---------+
| id | Name            | Salary  | Start_Date | Gender | Phone | Address | Department | Basic_Pay | Deductions | Taxable_Pay | Income_Tax | Net_Pay |
+----+-----------------+---------+------------+--------+-------+---------+------------+-----------+------------+-------------+------------+---------+
|  1 | Moinuddin Asraf | 1110000 | 2022-03-01 | MALE   |  NULL | Delhi   |            |      NULL |       NULL |        NULL |       NULL |    NULL |
|  2 | Albert Murphy   |   55000 | 2022-02-01 | NULL   |  NULL | Delhi   |            |      NULL |       NULL |        NULL |       NULL |    NULL |
+----+-----------------+---------+------------+--------+-------+---------+------------+-----------+------------+-------------+------------+---------+
2 rows in set (0.00 sec)

UC10:

mysql> CREATE TABLE Department (department_id int PRIMARY KEY ,Name varchar(30),Department varchar(30) NOT NULL,employee_id int,FOREIGN KEY (employee_id) REFERENCES employee_payroll(id) );
Query OK, 0 rows affected (0.09 sec)

mysql> desc Department;
+---------------+-------------+------+-----+---------+-------+
| Field         | Type        | Null | Key | Default | Extra |
+---------------+-------------+------+-----+---------+-------+
| department_id | int         | NO   | PRI | NULL    |       |
| Name          | varchar(30) | YES  |     | NULL    |       |
| Department    | varchar(30) | NO   |     | NULL    |       |
| employee_id   | int         | YES  | MUL | NULL    |       |
+---------------+-------------+------+-----+---------+-------+
4 rows in set (0.01 sec)

mysql> ALTER TABLE employee_payroll DROP COLUMN Department;
Query OK, 0 rows affected (0.17 sec)
Records: 0  Duplicates: 0  Warnings: 0

mysql> INSERT INTO employee_payroll VALUES(4, 'Terissa', 750000, '2022-03-01', 'FEMALE', 123456, 'NY', 123456, 123, 123, 123, 123);
Query OK, 1 row affected (0.01 sec)

mysql> INSERT INTO department VALUES (2, 'Terissa', 'Marketing', 4);
Query OK, 1 row affected (0.02 sec)

mysql> INSERT INTO department VALUES (1, 'Terissa', 'Sales', 4);
Query OK, 1 row affected (0.02 sec)

mysql> SELECT * FROM employee_payroll LEFT JOIN department ON employee_payroll.id = department.employee_id;
+----+-----------------+---------+------------+--------+-----------+---------+-----------+------------+-------------+------------+---------+---------------+---------+------------+-------------+
| id | Name            | Salary  | Start_Date | Gender | Phone     | Address | Basic_Pay | Deductions | Taxable_Pay | Income_Tax | Net_Pay | department_id | Name    | Department | employee_id |
+----+-----------------+---------+------------+--------+-----------+---------+-----------+------------+-------------+------------+---------+---------------+---------+------------+-------------+
|  1 | Moinuddin Asraf | 1110000 | 2022-03-01 | MALE   |      NULL | Delhi   |      NULL |       NULL |        NULL |       NULL |    NULL |          NULL | NULL    | NULL       |        NULL |
|  2 | Albert Murphy   |   55000 | 2022-02-01 | NULL   |      NULL | Delhi   |      NULL |       NULL |        NULL |       NULL |    NULL |          NULL | NULL    | NULL       |        NULL |
|  4 | Terissa         |  350000 | 2021-03-21 | F      | 123456789 | US      |    123456 |        123 |         123 |        123 |     123 |             2 | Terissa | Marketing  |           4 |
|  4 | Terissa         |  350000 | 2021-03-21 | F      | 123456789 | US      |    123456 |        123 |         123 |        123 |     123 |             1 | Terissa | Sales      |           4 |
+----+-----------------+---------+------------+--------+-----------+---------+-----------+------------+-------------+------------+---------+---------------+---------+------------+-------------+
4 rows in set (0.00 sec)
